ffff880140696240 1908918917 S Ci:8:003:0 s 80 06 0100 0000 0012 18 <
ffff880140696240 1908920519 C Ci:8:003:0 0 18 = 12010002 00000020 cf0f0810 00010102 0301
ffff8801e2c32480 1908920551 S Ci:8:003:0 s 80 06 0200 0000 0009 9 <
ffff8801e2c32480 1908921523 C Ci:8:003:0 0 9 = 09022000 01010280 32
ffff8801e2c32480 1908921539 S Ci:8:003:0 s 80 06 0200 0000 0020 32 <
ffff8801e2c32480 1908922523 C Ci:8:003:0 0 32 = 09022000 01010280 32090400 0002ff00 00020705 81024000 01070501 02400001
ffff8801e2c32480 1909105944 S Ci:8:003:0 s 80 06 0100 0000 0040 64 <
ffff8801e2c32480 1909108518 C Ci:8:003:0 0 18 = 12010002 00000020 cf0f0810 00010102 0301
ffff8801e2c32240 1909184653 S Ci:8:003:0 s 80 06 0100 0000 0012 18 <
ffff8801e2c32240 1909186518 C Ci:8:003:0 0 18 = 12010002 00000020 cf0f0810 00010102 0301
ffff8801e2c32240 1909192695 S Ci:8:003:0 s 80 06 0200 0000 00ff 255 <
ffff8801e2c32240 1909194522 C Ci:8:003:0 0 32 = 09022000 01010280 32090400 0002ff00 00020705 81024000 01070501 02400001
ffff8801e2c32240 1909195710 S Ci:8:003:0 s 80 06 0303 0409 00ff 255 <
ffff8801e2c32240 1909197523 C Ci:8:003:0 0 42 = 2a033200 30003200 0000ca00 85001800 00000000 0000ca00 85001800 00000000
ffff8801e2c32240 1909198649 S Ci:8:003:0 s 80 06 0300 0000 00ff 255 <
ffff8801e2c32240 1909200524 C Ci:8:003:0 0 4 = 04030904
ffff8801e2c32240 1909201650 S Ci:8:003:0 s 80 06 0302 0409 00ff 255 <
ffff8801e2c32240 1909203535 C Ci:8:003:0 0 30 = 1e034100 4e005400 20005500 53004200 53007400 69006300 6b003200 0000
ffff8801e2c32240 1909204676 S Ci:8:003:0 s 80 06 0600 0000 000a 10 <
ffff8801e2c32240 1909205523 C Ci:8:003:0 -32 0
ffff8801e2c32240 1909219645 S Ci:8:003:0 s 80 06 0100 0000 0012 18 <
ffff8801e2c32240 1909221523 C Ci:8:003:0 0 18 = 12010002 00000020 cf0f0810 00010102 0301
ffff8801e2c32240 1909224310 S Ci:8:003:0 s 80 06 0200 0000 0009 9 <
ffff8801e2c32240 1909225519 C Ci:8:003:0 0 9 = 09022000 01010280 32
ffff8801e2c32240 1909227334 S Ci:8:003:0 s 80 06 0200 0000 0020 32 <
ffff8801e2c32240 1909228518 C Ci:8:003:0 0 32 = 09022000 01010280 32090400 0002ff00 00020705 81024000 01070501 02400001
ffff880057cfe9c0 1909769685 S Ci:8:003:0 s 80 06 0100 0000 0012 18 <
ffff880057cfe9c0 1909771523 C Ci:8:003:0 0 18 = 12010002 00000020 cf0f0810 00010102 0301
ffff880057cfe9c0 1909773147 S Ci:8:003:0 s 80 06 0200 0000 0009 9 <
ffff880057cfe9c0 1909773523 C Ci:8:003:0 0 9 = 09022000 01010280 32
ffff880057cfe9c0 1909774674 S Ci:8:003:0 s 80 06 0200 0000 0020 32 <
ffff880057cfe9c0 1909775524 C Ci:8:003:0 0 32 = 09022000 01010280 32090400 0002ff00 00020705 81024000 01070501 02400001
ffff880057cfe9c0 1909776677 S Ci:8:003:0 s 80 06 0300 0000 00ff 255 <
ffff880057cfe9c0 1909778522 C Ci:8:003:0 0 4 = 04030904
ffff880057cfe9c0 1909779682 S Ci:8:003:0 s 80 06 0302 0409 00ff 255 <
ffff880057cfe9c0 1909781518 C Ci:8:003:0 0 30 = 1e034100 4e005400 20005500 53004200 53007400 69006300 6b003200 0000
ffff8801407fd0c0 1909782672 S Ci:8:003:0 s 80 06 0300 0000 00ff 255 <
ffff8801407fd0c0 1909784518 C Ci:8:003:0 0 4 = 04030904
ffff880057cfe180 1909785944 S Ci:8:003:0 s 80 06 0303 0409 00ff 255 <
ffff880057cfe180 1909788520 C Ci:8:003:0 0 42 = 2a033200 30003200 0000ca00 85001800 00000000 0000ca00 85001800 00000000
ffff880057cfe180 1909796020 S Bo:8:003:1 -115 7 = a4014a00 ef0000
ffff880057cfe180 1909797519 C Bo:8:003:1 0 7 >
ffff880057cfe180 1909797783 S Bi:8:003:1 -115 4096 <
ffff880057cfe180 1909798530 C Bi:8:003:1 0 5 = a4016f20 ea
ffff880057cfe180 1909801030 S Bi:8:003:1 -115 4096 <
ffff880057cfe180 1910814535 C Bi:8:003:1 -2 0
ffff8801407fd0c0 1910814563 S Bo:8:003:1 -115 15 = a4094600 a8a423b9 f55e63c1 740000
ffff8801407fd000 1910815895 S Bi:8:003:1 -115 4096 <
ffff8801407fd0c0 1910816517 C Bo:8:003:1 0 15 >
ffff8801407fd000 1910816532 C Bi:8:003:1 0 7 = a4034000 4600a1
ffff8801407fd000 1910817891 S Bi:8:003:1 -115 4096 <
ffff8801407fd0c0 1910817905 S Bo:8:003:1 -115 9 = a4034200 0000e500 00
ffff8801407fd000 1910818531 C Bi:8:003:1 0 7 = a4034000 4200a5
ffff8801407fd0c0 1910818536 C Bo:8:003:1 0 9 >
ffff8801407fd0c0 1910819897 S Bi:8:003:1 -115 4096 <
ffff8801407fd000 1910819912 S Bo:8:003:1 -115 9 = a4034300 0010f400 00
ffff8801407fd0c0 1910820531 C Bi:8:003:1 0 7 = a4034000 4300a4
ffff8801407fd000 1910820535 C Bo:8:003:1 0 9 >
ffff8801407fd000 1910821891 S Bi:8:003:1 -115 4096 <
ffff8801407fd0c0 1910821904 S Bo:8:003:1 -115 8 = a4024400 ff1d0000
ffff8801407fd000 1910822531 C Bi:8:003:1 0 7 = a4034000 4400a3
ffff8801407fd0c0 1910822535 C Bo:8:003:1 0 8 >
ffff8801407fd900 1910823888 S Bi:8:003:1 -115 4096 <
ffff8801407fdd80 1910823903 S Bo:8:003:1 -115 8 = a4024500 32d10000
ffff8801407fd900 1910824533 C Bi:8:003:1 0 7 = a4034000 4500a2
ffff8801407fdd80 1910824538 C Bo:8:003:1 0 8 >
ffff8801407fdd80 1910825892 S Bi:8:003:1 -115 4096 <
ffff8801407fd900 1910825906 S Bo:8:003:1 -115 9 = a4034900 5300bd00 00
ffff8801407fdd80 1910827531 C Bi:8:003:1 0 7 = a4034000 4900ae
ffff8801407fd900 1910827535 C Bo:8:003:1 0 9 >
ffff8801407fd300 1910829051 S Bi:8:003:1 -115 4096 <
ffff8801407fd0c0 1910829065 S Bo:8:003:1 -115 11 = a4055100 00000105 f40000
ffff8801407fd0c0 1910829516 C Bo:8:003:1 0 11 >
ffff8801407fd300 1910830529 C Bi:8:003:1 0 7 = a4034000 5100b6
ffff8801407fd300 1910831893 S Bi:8:003:1 -115 4096 <
ffff8801407fd0c0 1910831907 S Bo:8:003:1 -115 7 = a4014b00 ee0000
ffff8801407fd300 1910832531 C Bi:8:003:1 0 7 = a4034000 4b00ac
ffff8801407fd0c0 1910832536 C Bo:8:003:1 0 7 >
ffff8801407fd0c0 1910833891 S Bi:8:003:1 -115 4096 <
ffff8801407fd300 1910833904 S Bo:8:003:1 -115 8 = a4024d00 52b90000
ffff8801407fd300 1910834521 C Bo:8:003:1 0 8 >
ffff8801407fd0c0 1910835527 C Bi:8:003:1 0 6 = a4025200 02f6
ffff8801407fd0c0 1910837940 S Bi:8:003:1 -115 4096 <
ffff8801407fd0c0 1911834536 C Bi:8:003:1 -2 0
ffff8801398e2300 1911839062 S Bi:8:003:1 -115 4096 <
ffff8801398e2300 1912828534 C Bi:8:003:1 -2 0
ffff8800a284f9c0 1912829199 S Bi:8:003:1 -115 4096 <
ffff8800a284f9c0 1913842534 C Bi:8:003:1 -2 0
ffff8802154c5180 1913843017 S Bi:8:003:1 -115 4096 <
ffff8802154c5180 1914857531 C Bi:8:003:1 -2 0
ffff8800a284f3c0 1914858176 S Bi:8:003:1 -115 4096 <
ffff8800a284f3c0 1915871535 C Bi:8:003:1 -2 0
ffff88017a322a80 1915872047 S Bi:8:003:1 -115 4096 <
ffff88017a322a80 1916885534 C Bi:8:003:1 -2 0
ffff8800a082d900 1916885992 S Bi:8:003:1 -115 4096 <
ffff8800a082d900 1917879536 C Bi:8:003:1 -2 0
ffff8802084f20c0 1917880026 S Bi:8:003:1 -115 4096 <
ffff8802084f20c0 1918893534 C Bi:8:003:1 -2 0
ffff8800b43390c0 1918894011 S Bi:8:003:1 -115 4096 <
ffff8800b43390c0 1919907533 C Bi:8:003:1 -2 0
ffff8800c9c7f180 1919907993 S Bi:8:003:1 -115 4096 <
ffff8800c9c7f180 1920921535 C Bi:8:003:1 -2 0
ffff8802084f2180 1920921992 S Bi:8:003:1 -115 4096 <
ffff8802084f2180 1921202538 C Bi:8:003:1 -2 0
ffff880133db1cc0 1921202619 S Co:8:001:0 s 23 03 0004 0002 0000 0
ffff880133db1cc0 1921202637 C Co:8:001:0 0 0
ffff880133db1cc0 1921254739 S Ci:8:001:0 s a3 00 0000 0002 0004 4 <
ffff880133db1cc0 1921254761 C Ci:8:001:0 0 4 = 03010000
ffff880133db1300 1921314730 S Co:8:001:0 s 23 01 0014 0002 0000 0
ffff880133db1300 1921314733 C Co:8:001:0 0 0
ffff880133db1300 1921314746 S Ci:8:000:0 s 80 06 0100 0000 0040 64 <
ffff880133db1300 1921318524 C Ci:8:000:0 0 18 = 12010002 00000020 cf0f0810 00010102 0301
ffff880133db1300 1921318545 S Co:8:001:0 s 23 03 0004 0002 0000 0
ffff880133db1300 1921318551 C Co:8:001:0 0 0
ffff880133db1300 1921374731 S Ci:8:001:0 s a3 00 0000 0002 0004 4 <
ffff880133db1300 1921374753 C Ci:8:001:0 0 4 = 03010000
ffff880133db1300 1921434731 S Co:8:001:0 s 23 01 0014 0002 0000 0
ffff880133db1300 1921434734 C Co:8:001:0 0 0
ffff880133db1300 1921434738 S Co:8:000:0 s 00 05 0003 0000 0000 0
ffff880133db1300 1921437523 C Co:8:000:0 0 0
ffff880133db1300 1921454732 S Ci:8:003:0 s 80 06 0100 0000 0012 18 <
ffff880133db1300 1921458524 C Ci:8:003:0 0 18 = 12010002 00000020 cf0f0810 00010102 0301
ffff880133db1300 1921458544 S Ci:8:003:0 s 80 06 0200 0000 0020 32 <
ffff880133db1300 1921462523 C Ci:8:003:0 0 32 = 09022000 01010280 32090400 0002ff00 00020705 81024000 01070501 02400001
ffff880133db1300 1921462597 S Ci:8:003:0 s 80 06 0303 0409 00ff 255 <
ffff880133db1300 1921468524 C Ci:8:003:0 0 42 = 2a033200 30003200 0000ca00 85001800 00000000 0000ca00 85001800 00000000
ffff880133db1300 1921468552 S Co:8:003:0 s 00 09 0001 0000 0000 0
ffff880133db1300 1921471523 C Co:8:003:0 0 0
